<?xml version="1.0" encoding="UTF-8" ?>
<vehicles xmlns:xsi="http://www.w3.org/2001/XMLSchema-instance"
	xmlns="http://com/vehicle/identifier/config"
	xsi:schemaLocation="http://com/vehicle/identifier/config vehicle-identifier-config.xsd">

	<vehicle>
		<id>vehicle 1</id>
		<frame>
			<material>plastic</material>
		</frame>
		<wheels>
			<wheel>
				<position>left rear</position>
				<material>plastic</material>
			</wheel>
			<wheel>
				<position>right rear</position>
				<material>plastic</material>
			</wheel>
			<wheel>
				<position>front</position>
				<material>plastic</material>
			</wheel>
		</wheels>
		<powertrain>human</powertrain>
	</vehicle>
	<vehicle>
		<id>vehicle 2</id>
		<frame>
			<material>metal</material>
		</frame>
		<wheels>
			<wheel>
				<position>rear</position>
				<material>metal</material>
			</wheel>
			<wheel>
				<position>front</position>
				<material>metal</material>
			</wheel>
		</wheels>
		<powertrain>human</powertrain>
		</vehicle>

<vehicle>
		<id>vehicle 3</id>
		<frame>
			<material>plastic</material>
		</frame>
		<wheels>
</wheels>
		<powertrain>Bernoulli</powertrain>
		</vehicle>

<vehicle>
		<id>vehicle 4</id>
		<frame>
			<material>metal</material>
		</frame>
		<wheels>
			<wheel>
				<position>left rear</position>
				<material>metal</material>
			</wheel>
			<wheel>
				<position>right rear</position>
				<material>metal</material>
			</wheel>
			<wheel>
				<position>right rear</position>
				<material>metal</material>
			</wheel>
			<wheel>
				<position>left rear</position>
				<material>metal</material>
			</wheel>
		</wheels>
		<powertrain>Internal Combustion</powertrain>
		</vehicle>

<vehicle>
		<id>vehicle 5</id>
		<frame>
			<material>metal</material>
		</frame>
		<wheels>
			<wheel>
				<position>rear</position>
				<material>metal</material>
			</wheel>
			<wheel>
				<position>front</position>
				<material>metal</material>
			</wheel>
		</wheels>
		<powertrain>Internal Combustion</powertrain>
		</vehicle>

<vehicle>
		<id>vehicle 6</id>
		<frame>
			<material>metal</material>
		</frame>
		<wheels>
			<wheel>
				<position>rear</position>
				<material>metal</material>
			</wheel>
			<wheel>
				<position>front</position>
				<material>metal</material>
			</wheel>
		</wheels>
		<powertrain>Internal Combustion</powertrain>
		</vehicle>

<vehicle>
		<id>vehicle 7</id>
		<frame>
			<material>metal</material>
		</frame>
		<wheels>
			<wheel>
				<position>rear</position>
				<material>metal</material>
			</wheel>
			<wheel>
				<position>front</position>
				<material>metal</material>
			</wheel>
		</wheels>
		<powertrain></powertrain>
		</vehicle>

</vehicles>